,corpus,val
0,but staff horrible u,0
1,completely fair redeeming factor food average but could not make deficiency teodora,0
2,go and not enjoy say not get,0
3,very overpriced and not very tasty,0
4,not mayonnaise forgot toast left ingredient (ie cheese omelet) hot temperature and bacon cooked crumbled plate touched,0
5,cannot help bought fast,0
6,eaten handful time no reason besides sheer convenience,0
7,very disappointed,0
8,money went interior decoration none went chef,0
9,seat uncomfortable sitting wall wooden bench,0
10,not back,0
11,not value joint,0
12,little rough delivery,0
13,price reasonable,0
14,service poor,0
15,roth's twice and time very disappointing,0
16,end left mild broth noodle slurp cup,0
17,hardly good thing present restaurant,0
18,but not come empty stomach,0
19,not wanted hear,0
20,not wow dining experience,0
21,menu very limited - think counted 4 5 entree,0
22,not crazy sake martini,0
23,service varys day day- sometimes not nice,0
24,unfortunately food outstanding but everything else restaurant pit,0
25,beef well done and dry,0
26,ordered special grilled branzino infused bone difficult eat,0
27,I never treated rudely,0
28,also ordered delivery and restaurant forgot half order,0
29,server checked u maybe twice entire meal,0
30,strong scent coming left and right negatively affected taste bud,0
31,stalling could understand coming but le hour and not even brought u check yet,0
32,tried make reservation but time hostess not name,0
33,restaurant used pretty decent,0
34,tiny and felt like eating someone's living room,0
35,terrible service bland food not mention unaccommodating manager overall experience horrible,0
36,last time went seated table corridor next kitchen,0
37,not impressed food,0
38,yes use fancy ingredient but even fancy ingredient not make good pizza unless someone know get crust right,0
39,looking outside one would hesitate enter hole wall (really is),0
40,food average and creme brulee awful - sugar charred not caramelized and smelled kerosene,0
41,entire family horrified,0
42,but forgotten important part restaurant food,0
43,should done back room - away customer,0
44,glad luxury throw paying customer,0
45,first waitress completely unattentive 2 time saw her(odd restaurant 6 tables) and got order wrong,0
46,not go,0
47,food bland oily,0
48,fried platter greasy,0
49,look dont know people wrote review ever decent place (please try someother places),0
50,went mommy (the person could afford taking here),0
51,last time went waitress not come back taking order,0
52,completely hooked place ridiculous,0
53,eating atmosphere save but desk very disappointing experience,0
54,not,0
55,(la rosa connected swinging door mexican restaurant pacifico),0
56,could handled better,0
57,environment romantic but food horrible service pathetic and gabriella lie everything could,0
58,came table burned beyond recognition and stringy,0
59,pad thai and noodle sticky,0
60,hostess rude point offensive,0
61,narrow corridor lead tiny space three tiny white tiled counter great deal mess (stacks bottle cans) and small counter holding 12-14 entree,0
62,would rather tried terrace sky water club price,0
63,okay service,0
64,food awful atrocious actually,0
65,never visit restaurant,0
66,not go,0
67,ok server wander around little clueless but enough server crowd get -- fine make small effort get attention,0
68,good luck getting table,0
69,service awful,0
70,ignore trendy wannabe,0
71,amma worst value money experienced nyc past 2 year,0
72,think would pretty good spot not overpriced and overrated,0
73,place would better staff changed,0
74,walk-in risky,0
75,not give u dinner special asked,0
76,annoying thing though fact server seem trained drive revenue,0
77,still sitting bar drank sangria but facing away bar turned back around $2 gone people next u said bartender took,0
78,got one overrated restaurant brooklyn,0
79,went last night 2 year anniversery and not impressed,0
80,rather pathetic took hour seat u,0
81,seated promptly reservation however service slow,0
82,first slightly skeptical sushi restaurant middle nyc,0
83,however not worth special trip,0
84,but nothing stand cooking,0
85,problem go mcdonald's and destroy inside,0
86,egg benedict brunch worst entire life tried removing hollondaise sauce completely failed,0
87,bad food not heritage,0
88,I not picky - but actually gross,0
89,finally unable make gin and tonic -- could not find tonic,0
90,dim sum ok but not taste fresh and little dish not look steamy hot should (also note lack chinese here),0
91,despite untasteful previous review,0
92,not judge place prima facie try believe home away home literate heart,0
93,also $15 very pricey,0
94,want good authentic thai place not place go,0
95,want good authentic food place not place go,0
96,somewhat pricey but heck,0
97,true place not cheap,0
98,noise level unbearable conversation impossible,0
99,stumbled leon thought found quite gem but certainly wrong,0
100,instead wasting time here: support restaurant care food,0
101,head and shoulder neighboors east 6 st taj mahal also very comparable food quality much overpraised (and underdeserving) baluchi's,0
102,man hosting promised save table party 7 sat party 2 very table saving (mean boths open around),0
103,sitting eating subpar food manager proceeded berate couple employee putting wrong container condiment and explained expensive container,0
104,david daytona beach fl must visit,0
105,ordered tuna melt - came without cheese made tuna sandwich,0
106,waiter not attentive except bill turned table finished,0
107,generally like good restaurant and eat often but kai way expensive got,0
108,not eat unless starving thai food and work next door,0
109,people want great food plus great service roxy place avoid,0
110,quite frankly worst sushi ever tried,0
111,overall price tag very very expensive something expect,0
112,even overcharged last time,0
113,fish overdone,0
114,also make sure pay attention music piped - quite weird selection,0
115,could get much better dining experience amount money lot french bistro,0
116,surprisingly nothing could truth,0
117,better roof sutton place 19 year old intern jabbing rib night,0
118,received apology left see show without dinner,0
119,table next u asked crushed grape long overdue bottle wine finally arrived,0
120,could not catch waiter's eye and ignored u,0
121,plain and simple bad thai food,0
122,refuse seat party 3 weekend,0
123,waitress seems concerned looking good actually waitressing,0
124,disaster,0
125,threw fiance's surprise 30th birthday dinner could not happier,0
126,reason seafood menu unavailable except salmon,0
127,hostess and waitress incredibly rude and everything could rush u,0
128,next time would not dare ordering anything else simple asian appetizer and drink,0
129,lazy folk not want come alphabet city say good - stay,0
130,otherwise place great service and price and nice friendly atmosphere,0
131,place would much better served run group actually understands customer service,0
132,fourth try two year period and I done,0
133,probably would not go,0
134,would not even complained food least tasted good but quality food crappy,0
135,next hour and half stood crowded lobby area touristy restaurant listening type explanation not seated,0
136,$600 ( ever paid) not even waving magic wand ever get u back repeat performance,0
137,horrible,0
138,terrible terrible management - deserves shut-down,0
139,italian food flavor (that sort surprising ues) and service turn nightmare attentive sort remind ny yankee late 90's no matter bad look knew rally around corner,0
140,came restaurant expecting surprised but left bored and overcharged,0
141,really though seasoning?,0
142,thick and slightly soggy,0
143,maybe unintentional mistake but I experienced restaurant not appreciate practice,0
144,offer subpar service and no personality,0
145,diner food bistro price bummer,0
146,thoroughly enjoyed food annoying scream across table conversation,0
147,place not,0
148,first place *not* romantic claimed citysearch's editorial review,0
149,food not very tasty portioins tiny even high quality restaurant,0
150,others go restaurant and feel sad eaten,0
151,big and gawky outside,0
152,not recommend lunch special tasts regular chinese restaurant,0
153,searching really hard restaurant new york could really feel unwanted and ignored and finally found,0
154,definately not place go want impress someone,0
155,well delivery take ever and food usually cold,0
156,ordered smoked salmon and roe appetizer and flavor,0
157,food lousy - sweet salty and portion tiny,0
158,took 25 minute bring appetizer,0
159,anyway last time cross williamsburg,0
160,but big bun,0
161,tips: skip turnip cake roast pork bun and egg custard,0
162,oh yes and lie phone claiming seating garden course seat not available,0
163,anybody like place must different planet greasy dry and tasteless complimentary,0
164,calzones horrific bad vomit-inducing yuck,0
165,take forever get drink and almost always forget bring something (although dont forget charge,0
166,first waiter served u neglected fill u special would chosen known,0
167,back-to-back diner table behind and wait staff hoist tray head squeezed past u and,0
168,food terrible and overall would say avoid cost,0
169,unfortunately food not something get worked,0
170,asked open faced cheese sandwich and manager basically told take business elsewhere,0
171,not mind noise go chart house,0
172,happens ask real naan,0
173,fan half-price saturday night option inedible squid recent visit,0
174,yo really not care sittingnext 2 inch away would say try,0
175,left never return,0
176,no apology restaurant week,0
177,food reliable and price moderate,0
178,aside bearded courdoroy blazer professor type nyu student sleeping week see strange mix hipster frat boy smith type need told black bitter cougar cant understand arent married yet,0
179,dont place still running,0
180,share table loud group kid and service rude unattentive,0
181,told wait twenty minute and would no problem 8:00 pm curtain call,0
182,not mind-blowing but thai food never and never,0
183,even though little loud not yell talk,0
184,surprisingly disappointed,0
185,sushi awful,0
186,plain pizza soggy and creative wild mushroom(third generation-fornini) pizza drenched truffle oil middle( making soggy) and nothingon rest,0
187,late nite omelletes not good no variety,0
188,everything sala thai tasty and well-portioned,0
189,complained small tip,0
190,delivered would make mint,0
191,went wife and wait table even though could see many empty not reservation sigh,0
192,really disappointed ant wanted tell everyone not go eat even take food,0
193,website and rating make place look wonderful but reality very disappointing,0
194,definitely would not go back,0
195,not worth buck,0
196,oh not even let start expensive bill,0
197,scallion pancake and fried dumpling nothing ordinary,0
198,besides table promised given restaurant patron twice actually seated served dish not ordered three time received one order 20 minute rest table served (and order undercooked) and charged $45 should bill,0
199,food inconsistent,0
200,octopus eater floored octopus salad,0
201,thought place using much msg cooking food,0
202,and tom kha soup pathetic,0
203,tends turn people away,0
204,drawbacks: service slow and not toast,0
205,everytime decide try another place ues get angry not go zucchero pomodori,0
206,going since opened seen quality value decrease considerably,0
207,never anything not like,0
208,not break bank but also wouldnt come back food,0
209,I joya twice and never go,0
210,rushing u absolutely unnecessary,0
211,no refill fountain drink though,0
212,crowded and loud cannot even talk person next,0
213,ruby foo's tourist trap,0
214,I couple time and not impressed,0
215,like saying bread come special bakery seen buying dowtown manhathan,0
216,not go place good meal,0
217,treated attitude ever since moment stepped restaurant,0
218,but not ever order bacon late nite (either platter sandwich matter not take place) morning frying turn hard almost like bacos hurt molar,0
219,town worth searching another place,0
220,restaurant not worth time effort money say least,0
221,planning get dessert but waitress basically bill u chance order,0
222,really really bad,0
223,came cooked and cheese almost non existant,0
224,usually go later night get work not deal crowd line,0
225,2 try waiter take away (we not even looked yet full beer yet drink) manager approached and told u needed table people reservation,0
226,would not recomend dinner,0
227,sauce watery and food not much flavor,0
228,first wrong bread came appetizer tried order second glass wine main course,0
229,make reservation but expect delayed 15-20 minute hosting staff difficulty seating guest arrived reservation probably lot walk in close time square,0
230,also little expensive average bagel place,0
231,food undercooked-the sauce watery and vegetable raw,0
232,sauce used also not exciting,0
233,rice poor quality and cooked badly hard,0
234,surprised say least and find practice not worth effort,0
235,also very limited seating and substantial wait getting food peak time,0
236,big disappointment around,0
237,no free drink,0
238,definitely highly not recommended,0
239,not waste money decor,0
240,given incredible architecture surrounding place no character,0
241,want save money not go,0
242,shame nice convenient place like pink pony ruined lousy service,0
243,first time citysearch did't call right,0
244,porcini mushroom pasta special tasteless seafood tagliatelle,0
245,eaten many pizza place around nyc and hand worst,0
246,dry and disgusting not even finish first piece,0
247,and price way high get,0
248,skip baroanda street (eurotrashy snooty and expensive) and check place,0
249,skip location and go one soho,0
250,staff ignored friend and entire time,0
251,yet paired rude service would never recommend anyone interested carrying kind conversation,0
252,need least three roll full and least $14 00,0
253,anyone ever dined thai restaurant huge disappointment,0
254,hot dog cold middle and bun stale,0
255,sad read bad review place got,0
256,avoid place,0
257,looked like shredded cheese partly done - still strip,0
258,based visit month ago returned week christmas and hugely disappointed,0
259,not food not ambiance not service agree previous review wait and wait wait staff very rude and get looking get right,0
260,pizza delivered cold and cheese not even fully melted,0
261,could rate people place would chart - unfortunately - pizza sorry - not best nyc,0
262,many good restaurant uws not need overpriced food absurdly arrogant wait-staff not recognize work glorified diner clumsy service and management not care,0
263,favorite chinese food general tao chicken not place,0
264,filled suit though never really feel terribly comfortable,0
265,waiter tend forget drink completely food portion tiny two people trouble sharing one entree,0
266,hate,0
267,but thing wife and hated loud and felt like 'bar' 'pub',0
268,priced upper intermediate range,0
269,live new york city find better food small restaurant outside time square and spend half amount,0
270,husband made excuse leave,0
271,not know think but no respect resident neighborhood ever since opened cabaret next door and blast loud music till three morning every weekend summer,0
272,ordered crab cocktail and soaked lime juice concoction could taste lime,0
273,not even table hour total,0
274,reading post always skeptical go minnow despite living park slope,0
275,turkey burger not cooked friend salmon completely raw,0
276,not corner chinese food takeout,0
277,told u sit anywhere and sat said table reserved,0
278,crispy chicken not u though,0
279,place amazingly bad,0
280,I several place dim sum and got worst,0
281,people restaurant pretty obnoxious and loud,0
282,sandwich dry tasteless and way overpriced,0
283,problem that-it sometimes kind affair,0
284,made dining experience uncomfortable,0
285,still stay away table next u walked table and another serf eventhough much longer,0
286,go back but sate homesick stomach craving,0
287,very disappointed restaurant,0
288,and conclusion culinary nightmare check given table knocking glass water,0
289,space bit small live music jazz night loud and cramped,0
290,never back,0
291,entree bland and small dessert not inspired,0
292,oh and tiny family stroller,0
293,pad thai lad nar and various dish look good paper but I better thai food le asthetically pleasing place,0
294,pizza little soggy,0
295,singapore mai fun no curry flavor whatsoever,0
296,problem manager complete incompetent,0
297,dirt top can soda,0
298,I still mad pay lousy food,0
299,decent thai food cute - though bit dank - little nolita hangout but service terrible,0
300,waiter actually poured water hand and walked away,0
301,worse $60 erroneously added $80 bill,0
302,cold enjoy,0
303,no reservation expensive tip and annoying stuff,0
304,sushi not anything spectacular price,0
305,but not toaster strange,0
306,menu choice similar but taste lacked flavor looked,0
307,main course decidedly subpar,0
308,someone else recommended dessert - also left,0
309,vegetarian really not good place go,0
310,not ordinary and beef version cheap (undercooked) beef,0
311,got club soda filled ice no lime,0
312,knowledge chef and waitress average,0
313,say never disappointing meal,0
314,disappointing food lousy service,0
315,price and small portion,0
316,waiter stepped foot second time reached adjust lighting,0
317,but thai definitely not great -- bland and indistinguished,0
318,service not one would expected,0
319,not think would go,0
320,and no mean feat,0
321,wish would change back,0
322,no pizza 33,0
323,noted crossed bill,0
324,needle say I never going back and should wary,0
325,server make feel like favor bring food,0
326,problem since paid 20 buck dish and order 5 dish get decent taste,0
327,rip-off ($8 95 four small meat patty steamed buns) and not worth trying,0
328,first took u long time find place,0
329,food and ambiance and imagine dreadful listen idle engine,0
330,immediately paid waiter took money and said okay guy outta,0
331,menu nothing like one website,0
332,ive asked cart attendant lotus leaf wrapped rice and replied back rice and walked away,0
333,sea become popular let go head,0
334,waitstaff very busy not outstanding service but I never dealt rudely,0
335,not worth,0
336,also bit hassle get without car (i happen live inwood),0
337,not waste time money,0
338,not concern much customer's health want make money,0
339,could not carry conversation routinely interrupted waitress and servant asking u order and hinting taking much time -- amazing sat,0
340,ate kai and disapointed,0
341,complaining chicken dish manager came tell u no one ever complained and not know dish supposed taste like,0
342,not understand hype,0
343,bartender unable tear away friend bar,0
344,anyways neighborhood eat good food would not waste time trying find something rather go across street tamari,0
345,not get either,0
346,like took leftover chicken poured oil and sprinkled pepper powder (the sauce translucent and red),0
347,one would think would get apology complimentary drink - instead got snobby waiter would not even take order 15 minute and gave u lip asked,0
348,brought glass and bottle and left bottle table,0
349,stay far away place,0
350,would go back,0
351,not worth price,0
352,service and food one would expect spending type money,0
353,menu changed portion even smaller lentil dish salty beyond edibility basmati rice dish lacked flavor,0
354,go somewhere else,0
355,look elsewhere,0
356,seriously doubt ever dine jimmy's bronx matter jimmy's uptown,0
357,co-worker wait almost hour delivery discover got not ordered,0
358,got something not order,0
359,real dissapointment,0
360,people rave ambience,0
361,charge le portion,0
362,people charge lot le,0
363,not upto hype,0
364,perhaps food considered extreme upper east side resident but rest u actually eaten ethnic food simply dull,0
365,but compared nearby joint horrible useless not worth,0
366,but whatever reason price twice high,0
367,relatively new area and tried pick bagel 2nd and disappointed service and thought food overated and pricey side,0
368,unpleasant experience restaurant,0
369,odd group people,0
370,not consistent,0
371,but not icing cake: tiramisu resembled nothing ever,0
372,drink got screwed acted put upon,0
373,but pizza way expensive,0
374,however work dinner not long ago colleague london noticed very large waterbug ceiling,0
375,enough said,0
376,chow fun and chow see really bland and oily,0
377,food bland and oily,0
378,food bland well oily,0
379,chicken bland,0
380,chicken lollipop oily,0
381,notice however table looked like pita instead naan,0
382,grilled cheese home afterwards better,0
383,finally seated waitress came twice-1 order and 2-for check,0
384,wait bar approx two hour,0
385,charge different price time,0
386,obvious no one restaurant idea experience japanese cuisine,0
387,term food -- nothing special limited several appetizer,0
388,asked certain dish prepared comparison similar thai restaurant replied not mcdonald's every place make thing differently understandable every place indeed different not need uncourteous customer and downright rude,0
389,not expect sit inside though table and always full,0
390,manager claimed could not compensate u anything bill show lack sophistication entire group,0
391,but far east,0
392,but looked menu not lot choice dumpling appetizer section,0
393,maybe say looked promising people like artery-clogging jewish deli food but turn poorly run and awful,0
394,3rd time manager remembered and treated like usual customer,0
395,could get toaster,0
396,decor really blah and not hip happening,0
397,appears owner's first venture and show great promise,0
398,ordered beef and noodle soup dish thai section menu but nothing got thai,0
399,worst excuse japanese food I ever encountered,0
400,million better place go city,0
401,okay-i not mind oily part (cause cooked way) but way bland,0
402,ordered chicken teriyaki dish and found chicken extremely dry,0
403,reservation 9pm but not seated 10:15pm,0
404,no excuse lousy service,0
405,three strike and restaurant,0
406,not enough wine glass either,0
407,not take seat bar and back half restaurant saw woman get nudged 40times sitting,0
408,no ture promise made,0
409,one should not go lucky strike food,0
410,service awful,0
411,time waited well half hour table (even though reservations),0
412,last memorial day tried make reservation but told closed weekend (interesting but ),0
413,night but hard hear conversation everyone else competing luxury - music playing background also voluminous,0
414,not thai,0
415,could drank 4 glass water and still parched - watch,0
416,go girl perfect place,0
417,forgot sandwich not include plastic fork and not include pita hummus platter,0
418,asian fusion many place downtown,0
419,service poor restaurant poorly lit staff not very attentive and would rather eaten mcdonald's joint,0
420,number 1 place alot work order truly earn called reputation,0
421,I several time and totally smitten,0
422,terrible experience,0
423,service slow wait order and get food although not crowded,0
424,food average service pathetic no ambience,0
425,one definitely least favorite,0
426,$160 2 filet 2 side appetizer and drink super expensive,0
427,left 8:00 pm packed and noisy,0
428,worker ignore and talk female customer time skipped order,0
429,visited orsay ny restaurant week and tried expensive menu,0
430,would never go back,0
431,three u arrived dinner 5:30 week night without reservation place close,0
432,money could easily better spent elsewhere (anywhere),0
433,drawback - not toast bagel and not make egg bagel,0
434,many drawback food service location,0
435,cornelia street look like broadway set west side story and inside po cool quaint really cannot top setting romantic dinner nyc,0
436,like others said not expect restaurant make night romantic and yes busy restaurant may require wait,0
437,also thin get cold very quickly and not filling,0
438,food nothing like menu description,0
439,however not understand extraordinary hype restaurant,0
440,food absolutely horrible,0
441,restaurant dirty and unkempt,0
442,drink way priced,0
443,main downside place nazi-like guy running constantly complains noise level,0
444,not like food came right ordered,0
445,but warning: use site weary very weary recommendation,0
446,sorry cannot rate better,0
447,food good ambience worse service worst,0
448,however service plain sesame crusted salmon,0
449,food mediocre best but horrible service made vow never go back,0
450,place should also low rating authentic,0
451,service terrible wait everything and ask several different people thing allowed served,0
452,went last thursday came home frustation,0
453,ordered dessert and drink but no refill offered,0
454,always say not customer,0
455,instead order something else might feel good,0
456,never brought u complimentary noodle ignored repeated request sugar and threw dish table,0
457,kitchen however almost always slow,0
458,people rude bit new york,0
459,service also horrible and ambience not great,0
460,pizza overpriced and soggy,0
461,pay least double italian restaurant city and still not compare,0
462,quality food little expensive,0
463,horrible,0
464,here's fake concern,0
465,please go different place,0
466,portion size small,0
467,nothing special place,0
468,cannot stay long time depressing,0
469,staff unwelcoming,0
470,vibe restaurant unwelcoming,0
471,definitely not worth price,0
472,definitely not worth hype,0
473,pay,0
474,end paying and,0
475,price $9 entree dinner and even le lunch,0
476,but would not wanna live,0
477,price high cramped and unappealing resturant,0
478,rarely visit,0
479,tuk tuk one rare choice go brooklyn,0
480,everything soft bread soggy salad and 50 minute wait time incredibly rude service deliver average food,0
481,bread stale,0
482,food soggy,0
