,corpus,val
3330,warm comfortable surroundings nice appointment (witness etched glass and brickwork separating dining rooms),1
3331,ran little late reservation but not problem get table immediately,1
3332,kudos haru,1
3333,arrived time reservation and seated promptly,1
3334,plan eating often,1
3335,well mannered pleasant staff tony employ,1
3336,flavor robust and subtle,1
3337,came friend's birthday and keep coming back ever since,1
3338,say $2 pint happy hour and cheapest oyster find city though quality best,1
3339,concluded tiramisu chocolate cake delicious,1
3340,grat time jekyll and hyde,1
3341,service great food fantastic,1
3342,little way not live neighborhood but definitely worth trip wherever,1
3343,lovely peaceful place eat outside,1
3344,sauce delicious and crust perfect,1
3345,great place take out-of-towners and perfect watching sunset,1
3346,since first dinner chance brunch orsay 3x,1
3347,great entree well,1
3348,teenage kid love,1
3349,food served small tasting portion (as option) very good dish better next,1
3350,guy awesome,1
3351,cater american palate but like hot let know and willing oblige,1
3352,loved place,1
3353,mango chicken and cannot go tell delicious and presentation beatiful,1
3354,care food and ambience,1
3355,would highly recommend place everyone occasion,1
3356,service fantastic,1
3357,recommend try hidden spot surely blowup very soon,1
3358,garlic mashed potato hand best city,1
3359,great romantic evening fun evening friend,1
3360,best pad thai I ever,1
3361,great pizza and fantastic service,1
3362,really not know expect restaurant literally overlook main hall grand central,1
3363,none yucky whipped stuff,1
3364,coffee quite good,1
3365,great wine list (italian) good food service initially fine,1
3366,know busy showing vintage tee shirt and looking bored but agenda I eat and enjoy company friend seeking pleasant experience,1
3367,normally would improper however delicious and host not complain,1
3368,taxan delicious,1
3369,unlike place nyc sandwich want come triple-decker get want reasonably-sized portion (and price),1
3370,dozen time and never failed enjoy experience,1
3371,two people tip le $25 buck,1
3372,killer sushi,1
3373,course reason packed food delicious,1
3374,jukebox play everything italian opera stroke,1
3375,place always packed,1
3376,plus made perfect martini,1
3377,waiter attentive,1
3378,margarita best I since I returned naples,1
3379,highly recommend restaurant based experience last night,1
3380,taste make mouth water,1
3381,came city try restaurant friend recommended husband,1
3382,wonderful experience cannot wait come back,1
3383,dining b o g twenty time official,1
3384,served free appetizer and portion perfect lunch,1
3385,actually space breathe and decor set tone intimate dinner,1
3386,went around 9:30 friday and died bit service great,1
3387,place realy fresh sushi and nice large menu japanese classic cuisine,1
3388,wife and also enjoyed spinach shanghai low mein and attraction,1
3389,owner must coem website give credit,1
3390,would go back,1
3391,definitely back,1
3392,dumpling fetish suggest try,1
3393,food consistently wonderful - I coming year and owner always accomodating and friendly,1
3394,live nearby and first opened ate lot,1
3395,and food fantastic,1
3396,kind place would like take friend and still keep secret,1
3397,looking place sit drink and conversation friend go sweet-n-tart and order hong-kong styled milk and tea tapioca pearl (hot),1
3398,aside sea urchin chef recommended assortment fish including fatty yellow tail boton shrimp blue fin torro (fatty tuna) sea eel etc,1
3399,also friendlier especially owner kenny,1
3400,room not particularly comfortable seated forget everything except plate,1
3401,winnie and staff best crew find serving,1
3402,ambiance minimal food not phenomenal but dish quite good eggplant parmesan veal carozza chicken saltimbocca,1
3403,even get package chutney stock fridge,1
3404,bar various selection and mixed drink special catcher 2 1's,1
3405,slightly pricey side but worth,1
3406,like ambience very dark and original,1
3407,not typical nyc gimmick theme restaurant,1
3408,exploring grand central and not want eat food court,1
3409,pick bagel best bagel city,1
3410,paying atmosphere nice but numerous place bay ridge,1
3411,called gnochi alla nona and found chef special,1
3412,one nicest outdoor restaurant ever seen ny--i italy and place rival one country,1
3413,yes wait seated and small no waiting area and seat bar taken,1
3414,fried dumpling great,1
3415,place best chinese style bbq rib city,1
3416,ive many time waiter know name,1
3417,decor very simple but comfortable,1
3418,I frequenting tasting room since first arrived east village and I never disappointed,1
3419,figured never argentinian pizza grabbed lunch sharing large pelligrino pizza two special one goat cheese blue cheese and excellent,1
3420,heartland brewery great way start finish day,1
3421,'kamasutra' and 'bombay cosmopolitan' excellent and tipsy no time,1
3422,perfect date spot williamsburg couple,1
3423,$6 and much tasty food fresh and continually refilled,1
3424,straight cheap good food,1
3425,another welcome addition neighborhood,1
3426,seating ok even though sometimes alot people,1
3427,steamed fresh brought hot hot hot table,1
3428,and affordable,1
3429,staff make feel home food great and atmosphere wonderful,1
3430,actually feel like should keep secret,1
3431,very diverse menu something everybody,1
3432,long-time patron mamoun's always figured found best late night food spot city,1
3433,bagel huge,1
3434,go relax and feel like somewhere else,1
3435,very nice surprise,1
3436,french and really felt like home,1
3437,casimir 5 time and always great time,1
3438,service thing good restaurant,1
3439,usually packed good reason esp,1
3440,service- friendly and attentive,1
3441,love going,1
3442,great food great decor great service,1
3443,I dined alain ducasse's restaurant monte carlo half price excellent dining experience,1
3444,save money and not waste calorie go margharita's washington street instead amazing food and best service,1
3445,service attentive without overbearing and dish tried wonderful spring roll cod pineapple tempura,1
3446,but trust worth,1
3447,perfect spot,1
3448,sell special sushi everything topping sauce and etc,1
3449,place small and intimate and may feel little crowded but service excellent and great friend romantic date special occassion,1
3450,service excellent and food delicious,1
3451,service also very good,1
3452,took girlfriend birthday last night and relaxing really good meal,1
3453,I happy nosh neighborhood and food very comforting,1
3454,good atmosphere combination hottest music dress code relatively strict except friday,1
3455,love food,1
3456,would highly recommend nina's anyone want romantic dinner heart warming surrounding filled candle and family picture,1
3457,dessert group tried got favorable review,1
3458,nice place relax and conversation,1
3459,place got best japanese restaurant new york area,1
3460,best reuben sandwich ever,1
3461,lucky strike great casual place grab bite eat,1
3462,wonderful strawberry daiquiries well,1
3463,going volare like going favorite aunt's house dinner assuming aunt great italian cook,1
3464,loved and would go,1
3465,frites delicious bit thick side,1
3466,good,1
3467,hundred italian restaurant queen among best,1
3468,very good value,1
3469,would recommend putting name and getting drink local bar first though wait time,1
3470,fell love egg noodle beef broth shrimp dumpling and slice bbq roast pork,1
3471,keep finger crossed whole subway ride hoping table sit and not share rice congee soup people,1
3472,overall best bagel town,1
3473,everything ny pizza joint should,1
3474,huge delicious fresh and reason return,1
3475,go often,1
3476,sushi seemed pretty fresh and adequately proportioned,1
3477,saw website link da ciro napoli knew going good pizza,1
3478,indoor very cozy and cute,1
3479,3 hour brunch- definitely not rush you- and kept unlimited mimosa flowing whole time,1
3480,terrific,1
3481,service excellent food excellent but entire experience very cool,1
3482,service good and resturant clean,1
3483,great spot whether looking couple drink quiet dinner,1
3484,I rarely problem slow staff 10 year I going,1
3485,food excellent,1
3486,although looking regular lettuce and walnut salad got great,1
3487,excellent lunch buffet $6 95,1
3488,sorry check list enjoyed and recommended place past,1
3489,very reasonably priced (around $8 dinner and $5 lunch) and delicious and filling,1
3490,problem nothing prune particularly memorable,1
3491,ambience cute and quaint good business although vacation,1
3492,portion size huge and sushi good,1
3493,wish would expand,1
3494,boyfriend ate tuna and cooked perfectly,1
3495,not expected menu comprised pad thai and tom yum soup but thought made place special,1
3496,good food restaurant (a bit expensive but great want impress date),1
3497,highly recommend caviar russe anyone want delicious top grade caviar and fantastic service,1
3498,eaten 3-4 time and food always good,1
3499,keep good work,1
3500,not thrilled wait line thirty minute but guess price pay popular place,1
3501,great eats good time,1
3502,make sure try place often,1
3503,grilled whole fish wonderful great spicing,1
3504,year thought tuscan cuisine best but salvatore converted hearty neapolitan fare first visit,1
3505,plus entree held kitchen busy saturday night owner sent complimentary summer roll hold u,1
3506,service great well,1
3507,try lobster teriyaki and rose special roll,1
3508,another plus entree approx,1
3509,go back suan soon,1
3510,loved,1
3511,food delicious atmosphere relaxed and adopted plate 347 secret second,1
3512,pleasantly surprised,1
3513,moment walked accomodating even though place packed,1
3514,found food service and value exceptional everytime,1
3515,drink saving grace but service staff please get,1
3516,wonderful,1
3517,all-italian staff warm and engaging start,1
3518,village one place score front,1
3519,price exceptionally reasonable food caliber,1
3520,go - focus should tamarind margarita,1
3521,best hidden spot and rave everyone,1
3522,filet mignon dish superb,1
3523,regular due consistently good food and ease getting table,1
3524,cannot wait wait next visit,1
3525,place japanese ever get,1
3526,food good cannot lie,1
3527,great food lt's one person eat,1
3528,atmosphere nothing special but feel like sushi establishment tokyo,1
3529,cozy romantic atomosphere around 15 table,1
3530,really like scallop and mahi mahi (on saffron risotto-yum ),1
3531,ambience fun and price great top fact food really tasty,1
3532,sandwhiches out-of-this world,1
3533,live upper manhattan siam square place thia food,1
3534,decor charming,1
3535,food very well prepared,1
3536,really tasty spring roll and noodle good price though,1
3537,people attest spending $50 drink new york bar and hardly feeling thing drink plentiful and unique,1
3538,complimentary stuff kept coming and waiter saw opening gift received dessert plate happy birthday written candlevery nice touch and attentive staff,1
3539,go pre-theatre menu even greater deal,1
3540,one front smile and say get brother?,1
3541,brava la pizza fresca,1
3542,someone appreciates simplicity elegance and wonderfully presented and tasting seafood and vegetable regardless portion size kai place,1
3543,price cannot beat quality quantity freshness and taste,1
3544,check not hurt stomach wallet,1
3545,little tonino's awesome favorite delivery place kennsington honestly best gnochi ever,1
3546,4 time and always great meal,1
3547,go back line like three time average cannot walk anymore,1
3548,usually get dinner special and very reasonably priced and very tasty,1
3549,wine and cheese plate plentiful and cannot wait try fondue table grilling,1
3550,bleecker st pizza best,1
3551,treated u well and food extremely fresh and well-prepared,1
3552,exotic salad basic ly delcious little green salad peanut sauce perfect sweet basil fried tofu,1
3553,volare virgin weekly regular everyone get treated and cannot ask service friendly,1
3554,chicken and steak seasoned and cooked perfection and lamb sandwhich great heartier appetite,1
3555,faan sooo good,1
3556,no going go back food good,1
3557,food great and service even better,1
3558,hardly called restaurant possibly best deal manhatten: $4 plate heaped rice and 2-3 entree,1
3559,traditional french decour pleasant though hall rather noisy - restaurant full and raise voice able maintain conversation,1
3560,fish fresh and piece sliced perfection and seasoned sushi chef (usually little fresh wasabi and soy sauce but also sometimes sea salt),1
3561,son and girlfriend wanted cheeseburger and huge,1
3562,really recommend very simple unda (egg) roll,1
3563,unbelievable,1
3564,very good wine choice,1
3565,thai place go nyc wonderful and live relaxed jazz certain night,1
3566,back,1
3567,big group place perfect recomends sharing - lazy susans table - even family feel comfortable,1
3568,tasty steak pork loin work,1
3569,went 5 friend and lingered table bit and not feel rushed even though wait,1
3570,went ruby foos birthday and enjoyed experience,1
3571,I would highly recommend special occasion -- provides and intimate setting and nice service,1
3572,burger great also,1
3573,cheap not mean portion small food nasty great,1
3574,pizza great,1
3575,never edamame pureed but thought innovative and tasty (could've used bit salt),1
3576,notified not mention special not apologize but let u know made very good decision regardless,1
3577,price extremely reasonable appetizer and food ate,1
3578,kenny owner always and treat family like part family,1
3579,need kick but sushi pretty good and place consistent,1
3580,I wait time lunch but place definitely worth wait,1
3581,delicious food excellent service and pretty atmosphere make great choice dinner and $5 99 lunch buffet make even better choice lunch,1
3582,appetizer recommend shrimp fritter and dumpling,1
3583,and cheap,1
3584,try time square cocktail -- ginger lemonade vodka (also available without vodka ),1
3585,nice find,1
3586,veal parmigana - better patsy's,1
3587,great wine great food,1
3588,food and staff always surprise new height taken,1
3589,amazing,1
3590,I always seated propmtly,1
3591,try frequenting new restaurant city but time visit restaurant roth's always disappointed,1
3592,nothing pleasant,1
3593,would recommend place anyone and would without doubt come,1
3594,however want great food great price and not mind decor cannot beat place,1
3595,make restaurant special authentic sichuan cooking and one nyc offer authentic chongqing hotpot,1
3596,sure keep coming back feel really restaurant deserves,1
3597,interesting dish change include chicken curry sauce and salmon caserole,1
3598,one favorite restaurant neighborhood,1
3599,one favorite though angry lobster cold lobster salad magnificent,1
3600,say pleasantly suprised and likely stop neighborhood,1
3601,ask usha nicest bartender manhattan,1
3602,service outstanding and crab-cake egg benedict could not better,1
3603,place's decor and hidden bathroom made good laugh,1
3604,true gem village,1
3605,location good and fact hutner college near and price very reasonable make student go back suan and,1
3606,however think jeckll and hydest one place fun,1
3607,treat like family morning and night,1
3608,wonderful place,1
3609,please take advice go and try place,1
3610,birthday and excellent time,1
3611,went amma friend recommended,1
3612,kind small place but guess not busy might able fit group kid,1
3613,also ordered two hot dog thinking would pretty good since whole section menu devoted,1
3614,dish like 6 piece beef,1
3615,might little spicy friend couteract eat rice and keeping water hand,1
3616,place always very crowded and popular,1
3617,really depends luck,1
3618,enter feel like entered mom's kitchen,1
3619,tired and cold got restaurant sat begin ordering appetizer,1
3620,and visit make point eat 'ino least daily not whole trip,1
3621,not half-price saturday night special but tuesday night,1
3622,small group u looking somewhere eat kinda late weeknight and ended pastis,1
3623,meetball night,1
3624,want impress?,1
3625,selection change frequently but basic dish always available,1
3626,get soup and nosh (pastrami sandwich) $8 and golden,1
3627,say make easier get saet lunch- dont mind,1
3628,family and ate last night annual christmas dinner family member would rather spend holiday friend out-of-town,1
3629,grew bagel,1
3630,cannot go wrong,1
3631,china phrase good restaurant hot and loud,1
3632,not find anywhere manhattan,1
3633,went afternoon friend,1
3634,first greeting entered last call 10:15,1
3635,guess way friend and described french colony,1
3636,able squeeze 6 called night anniversary friday night reservation and told would treat u well occasion,1
3637,walked seemed like 200 year,1
3638,ahhh good back,1
3639,shared bottle sake order edamames and sushi plate sashimi,1
3640,appetizer ate dim sum and variety food impossible criticize food,1
3641,table pot boiling water sunken surface and get platter thin sliced meat various vegetable and rice and glass noodle,1
3642,going mid town location next,1
3643,burger not expensive,1
3644,clean excellent location and quite friendly,1
3645,excellent location and seat comfy,1
3646,nice place,1
3647,staff very attentive even thing went wrong,1
3648,location perfect,1
3649,everything perfect,1
3650,location ideal purpose,1
3651,excellent mean,1
3652,staff very helpful obliging and efficient,1
3653,great location london,1
3654,location good great and friendly staff,1
3655,great location good facility excellent value money,1
3656,good location nice bar,1
3657,excellent location and friendly staff would definitely stay,1
3658,very nice step and good system everything,1
3659,very nice hotel nice staff and clean,1
3660,friendly staff convenient location and comfortable room,1
3661,food inexpensive,1
3662,burger inexpensive,1
3663,fantastic food,1
3664,food amazing loved sitting arrangement & got best mocha ï¿½ï¿½,1
3665,good environment good food m loving go ahead,1
3666,good food friendly service -- expect,1
3667,taste hakka noodle & prawn unbelievable,1
3668,simply delicious loved platter and hope soon,1
3669,m love food good food nice ambiance n very nice service,1
3670,exceptional experience mega platter manu along corn soup good tasteful shrimpwrap and mouthwatering mongolian beef awesome loved menu but not happy accommodation kulfi added difference taste,1
3671,one best eatery dhaka keep :),1
3672,salt overpowered true flavour,1
3673,want good authentic thai place place go,1
3674,beautiful place dine interior take back mughal era soya chaap standout dish clearly one trademark dish per and must try,1
3675,dinner family turned good choose suitable age people price affordable recommend restaurant early dinner place little noisy,1
3676,great food and proper karnataka style full meal twice and fully satisfied give 5 star well managed,1
3677,very good restaurant neighbourhood buffet system properly arranged variety dish along garba dance and puppet show good spread dessert,1
3678,awesome food ??great servicefriendly staffsgood quality food complimentary breakfast good food quality like visit also outdoor dining available,1
3679,personally really liked place ambience great starter good and pizza price pretty affordable must visit place,1
3680,easily best cafpeaceful business talk study recommended meal peaceful and budget food,1
3681,happy see cafe nearby house cafe run couple and family really very polite and friendly price very reasonable and recommend place people like spend time friend,1
3682,friendly staff nice ambience colourful light hanging skeleton reasonable price nice music gud group friend enjoyed lot ??????,1
3683,went friend tea ambience striking say least umpteen variety tea basic chai and lemon tea variant like saffron and cranberry name also food go,1
3684,newly opened cafe near kims medical college spacious and pleasant ambiance must try chicken pakoda and crispy fried chicken \nsheesha happy hour offer good and affordable,1
3685,no word paneer one place u get authentic paneer dish hotel staff really good and food quality very very good \n\nparking : 2 wheeler and 4 wheeler available\npayment mode : cash and card\nnext time try pastry ')],1
3686,"redberry provideswonderful ice cream flavour and tasty delight fill tummy italian touch friendly staff's quick response towards customer food redberry good and tasty loved pizza serve nice place hangout friend one best place jump in"")",1
3687,opportunity try dessert and very intrigued tasted dessert and favourite cheesecake would definitely recommend dessert quality and taste ')],1
3688,stumbled upon zomato checking home delivery option yummy pizza- ordered corn veggie delight pizza crust good golden brown and generous topping certainly order again?') ('rated 5 0' 'rated\n best pizza ever best place and delecious food eveyone must vist place best pizza ? many variety ovenstory best part everything fresh'),1
3689,"located near bm college engineering \nfood quantity good price \nyou must try leefu chicken and chilli garlic noodle chicken lollipop also good \nsmall place but service and home delivery zomato good ') ('rated 4 0' ""rated\n got home delivery sunday night good chinese food and not very heavy pocket well chicken soup good chicken wing",1
3690,"restaurant serf best benne dosas period first tried benne masala dosa and stumped inherent taste dosa not require chutney along benne kaali another must try extremely crispy and light \n\neven tea restaurant very unique taste forced limit cup :-)\n\nhighly recommend restaurant "")]",1
3691,ordered pack dabeli r 49 today packing neat size dabeli mark taste yum value money :best place eating chat basket chaat and tokri chaat best eat value money and good ambience well maintained ')],1
3692,food good very homely rice sambhar rasam papad quick service very reasonable ambience ok cleanliness improved staff ok road side parking ')],1
3693,"perfect place burger coke and fry \nthis place provides best and delicious burger \n\ngood place hangout friends\ngood ambience\npleasant place') ('rated 4 0' ""rated\n good spacious place good service also extra element coffee and ice cream sort counter not outlet \nthe food pretty much mcd outlet "")]",1
3694,personally really liked place ambience rooftop plant music great \nthe starter good and pizza \nthe price pretty affordable must visit place '),1
3695,one best restaurant banglore roof top restaurant very good ambiance \nthis peaceful place u seat chat friend very good starter,1
3696,would say no healthy and tasty breakfast delivered ur home?\nhad ordered:\nmusk melon juice\ncarrot juice\nmushroom sandwich \nsandwich show stealer perfectly spiced and grilled generous amount mushroom completely loved and order soon?') ('rated 4 0' 'rated\n dish 1: corn sandwich\ntaste : 4 / 5\ndish 2 : masala puri\ntaste : 4 5 / 5\nplace : shree cool point ( vijaynagar)\nambience : no idea\nservice : no idea since home delivery\nvalue money : 4 / 5\n\nfirstly corn sandwich filled corn cheese n green chutney and perfectly toasted but little spicier side not really big fan masala puri but really yumm but felt quantity le home delivery quick and also feel price wer affordable and totally worth money ')],1
3697,dear biryani and \ni cannot express happy eaten food serve never but I ordered quite time and every single time amazed please express gratitude chef \never since came bangalore could not find aa single food joint good chicken biryani 65 and soup ordered dish I eaten outstanding \n\nthanks lot making day everytime order made fan and regular customer please keep good work and keep chef he/she magic \n\ni'll soon visit restaurant,1
3698,"momooooooooooo ? one best tasted ever place very famous people far distance come also spread pasta but choose momo anything seperate counter takeaway like street style and seating available highlight very le usage plastic package overall laaaavd "") ('rated 4 0' 'rated\n ordered chilli noodle and egg fried rice roving feast banashankri noodle really yummy and spicy well cooked and fresh egg fried rice little bland overall hygience wise good place",1
3699,what: continental food\n\nonline delivery food chain \n\nlast time food delivered bad condition second thought ordering place skeptical ordered chicken noodle but surprise food yummy time delivered wat ordered \n\nthanks prompt delivery and really enjoyed food '),1
3700,planner chilli and fried icecream fried icecream must try'),1
3701,"staff amazing although place small serve best waffle ordered bubble gum shake and coffee waffle loved taste crunchy outside and not completely soggy inside right way waffle supposed perfect big thumb ') ('rated 4 0' 'rated\n waffle not overloaded syrup\nhas enough sweetness\nbest vanilla ice cream\nthought waffle would bit bigger\nthe packaging delivery great') ('rated 4 0' ""rated\n love waffle and always order online place I very happy delivered product and also very tasty worth trying ?"")]",1
3702,peppy pepper located near bday complex serve fusion food and load option choose \nthe place very vibrant and spacious nice place chill and pocket \nthe service pretty quick \n\n? fav picks:\n\nthe hot chocolate very satisfying \nloved different type nacho and fry \nthey loaded cheese and veggies/chicken different dip \nthe thai green curry and quesadilla must try,1
3703,food very nice\n2) staff very good\n3) ambience simple and nice\n4) location restaurant very nice\n5) service little bit slow\n6) very good restaurant and good taste'),1
3704,excellent food spicy corn soup and sholey ke paneer soup average but paneer excellent great service excellent ambience ') ('rated 4 0' 'rated\n good place vegetarian food lover good service staff and dish also quite ok taste and appearance overall nice experience coming '),1
